web-scraper-order,web-scraper-start-url,club-image-src,club-name,club-description
"1523568745-322","https://knightconnect.campuslabs.com/engage/organizations","https://images.collegiatelink.net/clink/images/55326c26-b1e0-4288-8862-011e8742d1e9d78b957a-327d-4707-b281-73020c1914c4.png?preset=small-sq","Interdisciplinary Studies Student Association","The ISS is an academic club open to all majors that engages in philanthropic, social, volunteer and networking activities."
"1523568745-178","https://knightconnect.campuslabs.com/engage/organizations","https://images.collegiatelink.net/clink/images/538e96c2-77c7-40b3-bb1e-49584e4f0536af8f156d-3827-47cc-bc5d-913f7fd177e8.jpg?preset=small-sq","Chi Upsilon Sigma National Latin Sorority, Inc.","Chi Upsilon Sigma is the first independent Latin sorority. Founded in 1980, our goals include maintaining high GPAs and actively contributing to the scholastic achievement of the Greek Community as well as servicing those in need."
"1523568745-447","https://knightconnect.campuslabs.com/engage/organizations","https://images.collegiatelink.net/clink/images/6952eabe-e67f-475d-aca0-d2f6cbb383517372953f-b39d-415b-b864-90a6e0fe225e.jpg?preset=small-sq","Neptune Area Council","The mission of the Department of Housing and Residence Life is to provide students living in university housing with a safe and secure environment that is conducive to academic and personal achievement."
"1523568745-68","https://knightconnect.campuslabs.com/engage/organizations","https://images.collegiatelink.net/clink/images/53402390-ede8-4695-a0c0-88928e103b0b5c402fce-7196-4974-97e8-7da07a52ae70.jpg?preset=small-sq","A Heartfulness Meditation Experience","Heartfulness : Living by the Heart
By tuning in to our heart, we learn to be centered in our highest Self.
Strengthen that connection and cultivate an inner knowing that wisely directs and guides our lives."
"1523568745-461","https://knightconnect.campuslabs.com/engage/organizations","","O","National leadership honor society for UCF students"
"1523568745-273","https://knightconnect.campuslabs.com/engage/organizations","https://images.collegiatelink.net/clink/images/8a9b506d-11ff-48cb-bfd6-a1db2acf33cc0a2a6a32-796f-4432-a9c8-8d5fadcfc3b5.jpg?preset=small-sq","Gamma Phi Beta","To inspire the highest type of womanhood. We will build confident women of character who celebrate sisterhood and make a difference in the world around us."
"1523568745-591","https://knightconnect.campuslabs.com/engage/organizations","","S","The UCF chapter of the Society of Professional Journalists promotes achievement and provides real-world experience prior to entering the field of journalism following graduation."
"1523568745-271","https://knightconnect.campuslabs.com/engage/organizations","https://images.collegiatelink.net/clink/images/348b8b9d-b15a-4b80-9b8f-02b39b98fd44fab4433b-ceff-4a72-8d16-a4ac1533d391.png?preset=small-sq","Game Development Club","GDK assists the game development community at UCF by hosting Game Jams, guest speakers, industry networking and hands on professional experience.
Check our Facebook page for all announcements about events!
https://www.facebook.com/groups/GameDevKnights"
"1523568745-245","https://knightconnect.campuslabs.com/engage/organizations","https://images.collegiatelink.net/clink/images/3d464b75-7cdb-4665-9b1f-777cf70ab461775721a9-b1cc-4b87-8d8c-22c3965a4b11.jpg?preset=small-sq","Eta Sigma Delta International Hospitality Management Honor Society","Eta Sigma Delta International Hospitality Management Honor Society is an invitation only honor society for students whose focus is in the Hospitality Industry."
"1523568745-450","https://knightconnect.campuslabs.com/engage/organizations","https://images.collegiatelink.net/clink/images/7ed05259-4b26-47c4-a365-06d65b06ba0407f72f83-0b74-4524-84c6-a2ff0c69cc64.JPG?preset=small-sq","Nike Area Council","The mission of the Department of Housing and Residence Life is to provide students living in university housing with a safe and secure environment that is conducive to academic and personal achievement"
"1523568745-528","https://knightconnect.campuslabs.com/engage/organizations","https://images.collegiatelink.net/clink/images/91942b7f-bee8-4e72-8cac-335a2a7da25ea9ccecfc-6538-4e8a-a1e8-fc3aa2148081.jpg?preset=small-sq","Pulso Caribe","Multicultural Dance club at UCF that focuses on LA Style salsa and Modern Bachata. Open to all UCF students and for all levels!

Message us on Facebook for a quicker response : https://www.facebook.com/groups/PulsoCaribeatUCF/"
"1523568745-471","https://knightconnect.campuslabs.com/engage/organizations","https://images.collegiatelink.net/clink/images/cba378af-73ee-4a45-806c-776b414a46869e64aba7-8fef-4851-ac1a-bc05035b3e25.jpg?preset=small-sq","Outlanders at UCF","Our mission is to offer the students of the university an opportunity to enjoy the outdoors and all of its activities."
"1523568745-343","https://knightconnect.campuslabs.com/engage/organizations","https://images.collegiatelink.net/clink/images/40827235-ea55-4585-aef4-12c2fb869684717d938c-c5c1-4e43-8254-63273c5f88d1.jpg?preset=small-sq","Kappa Delta Sorority","Kappa Delta is a National Organization that inspires its members to reach their potential by offering opportunities for leadership, personal development, academic success and community service, all in the context of true friendship."
"1523568745-304","https://knightconnect.campuslabs.com/engage/organizations","https://images.collegiatelink.net/clink/images/5c8db581-096a-47d6-b5d6-6cf57a2fc2b0f6c10c0b-7c5e-4783-b1ac-71349573ba9f.png?preset=small-sq","Hillel","Central Florida Hillel is the Center for Jewish life on campus at the University of Central Florida."
"1523568745-91","https://knightconnect.campuslabs.com/engage/organizations","https://images.collegiatelink.net/clink/images/e2cd729d-14b6-4079-9eb2-dd14ddcef535c3dede11-6954-4ecb-afcf-a96692a6f204.jpg?preset=small-sq","American Association of University Women","The mission of  American Association of University Women is to advance equity for women and girls through advocacy, philanthropy, and research."
"1523568745-479","https://knightconnect.campuslabs.com/engage/organizations","https://images.collegiatelink.net/clink/images/c1b3ae68-4fb7-45f6-b5ec-c5c7e0199e687e905add-fdd6-4873-aa5c-586343cbdeff.jpg?preset=small-sq","Pegasus Palooza","As UCF's Official Welcome Week, Pegasus Palooza returns every Fall semester with a week full of social, academic, and service activities for students to get acquainted with the UCF campus, meet people, and simply to have fun!"
"1523568745-73","https://knightconnect.campuslabs.com/engage/organizations","https://images.collegiatelink.net/clink/images/a1eb37d6-6169-4fc7-a790-46f0ae043014e909fb0b-c54a-4516-ab2a-90be586e8ec6.png?preset=small-sq","Adventist Campus Ministry @ UCF","Adventist Campus Ministry is a Seventh-day Adventist Christian organization built on faith, friendship, and developing a closer relationship with Christ. Follow us @acmucf on Facebook, Instagram and Twitter!"
"1523568745-230","https://knightconnect.campuslabs.com/engage/organizations","","D","The Doctoral Program in Public Affairs Student Organization exists to create opportunities for members to enhance the skills necessary to build value in the Public Affairs Doctoral Program Degree within an effectual and interdisciplinary environment."
"1523568745-127","https://knightconnect.campuslabs.com/engage/organizations","https://images.collegiatelink.net/clink/images/ff93f51e-0b38-4e5f-a54e-6aa7a55b5b3432e46fdb-d14e-4b7b-a8ba-c475871aa65e.jpg?preset=small-sq","Astronomy Society","Our organization strives to create, enhance, and deliver a definite vehicle that will help its members cultivate the love and respect for the mystery of the cosmos."
"1523568745-586","https://knightconnect.campuslabs.com/engage/organizations","https://images.collegiatelink.net/clink/images/4e68fab6-fdb0-49de-b30f-c8c26369ef99a2547039-d9eb-4495-a784-a3d23bc54c95.jpg?preset=small-sq","Society of Environmental Engineers","SEE incorporates all sections of environmental engineering: solid and hazardous waste, air pollution, water, and wastewater. We also work with several professional engineering groups such as AWWA, AWMA, and FWEA."
"1523568745-154","https://knightconnect.campuslabs.com/engage/organizations","https://images.collegiatelink.net/clink/images/b816c53c-83e1-441a-99a8-1e02f76fe4f57b20b59e-fd05-4fc5-8cb8-b9b60163f588.jpg?preset=small-sq","Brazilian Student Association","The mission of the Brazilian Student Association is to integrate and support the Brazilian community, while promoting cultural awareness about Brazil and the Portuguese language."
"1523568745-309","https://knightconnect.campuslabs.com/engage/organizations","","H","HSMAI Collegiate Chapter is the leading resource needed to establish a successful career in the Hospitality industry by providing networking opportunities which offer sales and marketing knowledge and professional guidance."
"1523568745-89","https://knightconnect.campuslabs.com/engage/organizations","","A","Alpha Xi Delta is a social organization. This women's Fraternity's motto is ""Inspiring Women to Realize Their Potential."" The sisters of Alpha Xi Delta pride themselves on inspiring each other to achieve their goals."
"1523568745-426","https://knightconnect.campuslabs.com/engage/organizations","https://images.collegiatelink.net/clink/images/baff2d96-e10a-4c78-aaf0-a0492e8fb14df2a90c0c-0ea9-4e75-8857-5e961b53ad19.JPG?preset=small-sq","National Association for the Advancement of Colored People","To advance the economic, education, social and political status; to stimulate an appreciation of the African Diaspora and other people of color’s contribution to civilization; and to develop an an intelligent, militant effective youth leadership."
"1523568745-298","https://knightconnect.campuslabs.com/engage/organizations","https://images.collegiatelink.net/clink/images/2a87a97a-2c11-4f5d-a6d7-b447660c5aa84bdb96c3-c20c-4a95-8692-e6ea4007c113.png?preset=small-sq","Health Service Administration, Student Association","Welcome to the Health Services Administration Student Association (HSASA) at the University of Central Florida. HSASA is an organization comprised of students interested in pursuing careers in healthcare administration."
"1523568745-594","https://knightconnect.campuslabs.com/engage/organizations","https://images.collegiatelink.net/clink/images/34bd02e8-de17-474f-b635-44eb86c1bde3e892bf64-5c60-4336-86d5-7fc73b944909.JPG?preset=small-sq","Softball Club @ UCF","Mission Statement:  Provide a competitive and culturally diverse enviroment for those students who wish to play softball at the college level."
"1523568745-543","https://knightconnect.campuslabs.com/engage/organizations","https://images.collegiatelink.net/clink/images/968623db-6ed4-4804-b491-30d58e5c53516ac7afd2-6c5f-4597-bab0-b5009d41a2e6.JPG?preset=small-sq","Rock Climbing Club @ UCF","The Rock Climbing Club is for all UCF students who are interested in climbing. We accept climbers of all levels and are more than happy to accept students who are just getting involved with the sport!  Club practices are held twice a week at the off ..."
"1523568745-473","https://knightconnect.campuslabs.com/engage/organizations","https://images.collegiatelink.net/clink/images/1e4c3111-56ff-4870-bc00-fae276d0d37379b5240d-d267-4336-afa2-295735d72623.png?preset=small-sq","Pakistani Student Association","The mission of the Pakistani Student Association at UCF is to celebrate, promote, and share the rich culture of Pakistan with the UCF student body through service-oriented, social, and educational events."
"1523568745-300","https://knightconnect.campuslabs.com/engage/organizations","","H","The mission of the Department of Housing and Residence Life is to provide students living in university housing with a safe and secure environment that is conducive to academic and personal achievement."
"1523568745-405","https://knightconnect.campuslabs.com/engage/organizations","https://images.collegiatelink.net/clink/images/02961d2a-d673-4dc0-9613-807a4f0035c71e958c04-2b79-451d-9b6a-29b04eef9317.png?preset=small-sq","Meeting Professionals International","MPI Knights is a student organization aimed at planners and suppliers that touches every area of the hospitality industry. We work with meeting, convention, wedding, and non-profit planners, and hotel, restaurant, theme park, and independent suppliers."
"1523568745-410","https://knightconnect.campuslabs.com/engage/organizations","","M","Men's Ultimate Frisbee at UCF is traveling, competitive sport club. The sport of Ultimate is physically demanding but tremendously fun. It compliments certain rules of American football and soccer with those that make Ultimate unique. The club boasts t..."
"1523568745-458","https://knightconnect.campuslabs.com/engage/organizations","https://images.collegiatelink.net/clink/images/91e5370d-7ec7-40b4-b244-0172ade30a93b31f71f7-fbae-4d70-b2a4-c6459137aa56.jpg?preset=small-sq","Old Forms","This page can be used to access SGA Forms."
"1523568745-605","https://knightconnect.campuslabs.com/engage/organizations","https://images.collegiatelink.net/clink/images/79069464-6889-489f-8dc0-d8727cc7dac662e23777-27c1-4353-80cc-c09f928d553c.JPG?preset=small-sq","Street Racing Made Safe","The mission of Street Racing Made Safe is to stop illegal street racing and bring racing to the local track."
"1523568745-391","https://knightconnect.campuslabs.com/engage/organizations","https://images.collegiatelink.net/clink/images/417b25a0-79fa-4d69-a611-edd1b436ca6ae1efad84-2fbf-4211-bae6-e4bff46dd18e.jpg?preset=small-sq","LEAD Scholars Academy","LEAD Scholars Academy (LSA) will establish an environment that will provide comprehensive leadership education, development, and civic engagement opportunities for the UCF community."
"1523568745-550","https://knightconnect.campuslabs.com/engage/organizations","https://images.collegiatelink.net/clink/images/071bcb32-09e9-41e7-819d-7f35318dd15a6d02efd4-36cf-4efe-8b11-a627d4361237.gif?preset=small-sq","Rotaract Club","Rotaract Club at UCF is a part of a worldwide organization of young men and women who believe they can make a difference. We focus on leadership development, community service, professional development, international service, and social activities!"
"1523568745-313","https://knightconnect.campuslabs.com/engage/organizations","https://images.collegiatelink.net/clink/images/e31c808b-9fc6-42ef-b729-1ac44b88182d5bd3b890-348f-4acf-964f-53d7a4a25315.jpg?preset=small-sq","IgKnight","We are a nondenominational group who strive to live as Christ everyday. We want to IgKnight a fire in the hearts of people at UCF and show people how awesome God is!"
"1523568745-87","https://knightconnect.campuslabs.com/engage/organizations","https://images.collegiatelink.net/clink/images/a788030f-187e-40cf-b143-a17b6ddbfea3281900b4-2837-44c1-9d2d-61f10512c74e.jpg?preset=small-sq","Alpha Sigma Kappa - Women in Technical Studies","Alpha Sigma Kappa - Women in Technical Studies® is a unique social sorority for women pursuing technical majors."
"1523568745-527","https://knightconnect.campuslabs.com/engage/organizations","https://images.collegiatelink.net/clink/images/a9862007-c8f7-4b8b-b5f2-26559421690ba53e9375-0181-4d71-9df3-e3330a3f04aa.png?preset=small-sq","Puerto Rican Student Association","The Puerto Rican Student Association serves as liaison between the UCF and Puerto Rican community to support and unite Puerto Rican students at UCF."
"1523568745-488","https://knightconnect.campuslabs.com/engage/organizations","","P","Phi Delta Theta Fraternity is a brotherhood of gentlemen that exemplify the qualities of friendship, sound learning, and moral rectitude."
"1523568745-500","https://knightconnect.campuslabs.com/engage/organizations","https://images.collegiatelink.net/clink/images/b2f6c0a9-bf53-40d3-83cf-6b83a96bcfa76e923dd5-43f0-469e-b585-7ed7fa9bedc2.jpg?preset=small-sq","Pi Kappa Phi","To young men of character seeking an enriched collegiate and life experience,
Pi Kappa Phi provides uncommon opportunities for service and leadership,
empowering growth and brotherhood for life through shared experiences
and chances to change the world"
"1523568745-425","https://knightconnect.campuslabs.com/engage/organizations","https://images.collegiatelink.net/clink/images/7605189a-bc5d-4c42-8c85-88d1a427f9e2d84d3864-2ee7-4530-9ea3-29b302ffa41a.jpg?preset=small-sq","National Association for Catering and Events","Founded in the early years of Rosen College, NACE at UCF strives to provide students with knowledge and education about the hospitality industry, countless volunteer opportunities, and networking strategies to help further their future"
"1523568745-355","https://knightconnect.campuslabs.com/engage/organizations","https://images.collegiatelink.net/clink/images/842844ff-f0f4-40a8-bb7d-c6fd2187810f9254405d-957a-40a1-a290-f4ae8ccf0f18.jpg?preset=small-sq","Knightmare Bhangra","The mission of Knightmare Bhangra is to spread and preserve the rich North Indian cultural and traditional dance form known as Bhangra, as well as compete at Bhangra competitions with other schools and spread joy through the dance form."
"1523568745-460","https://knightconnect.campuslabs.com/engage/organizations","https://images.collegiatelink.net/clink/images/acf78580-c8ce-4655-8987-03159be2297d837d0e53-9ef7-4d66-bac9-b9a2c4f32d09.gif?preset=small-sq","Omega Psi Phi Fraternity, Inc.","The purpose of this chapter shall be to bring about a union of Omega men on the local, state, district and national levels who manifest high ideals of manhood, scholarship, perseverance, and uplift"
"1523568745-545","https://knightconnect.campuslabs.com/engage/organizations","https://images.collegiatelink.net/clink/images/5e74a8d7-fe0c-4f02-bcb7-4b32e70480337418a873-0265-477d-87df-b75c30727662.png?preset=small-sq","Rosen Area Council","The mission of the Department of Housing and Residence Life is to provide students living in university housing with a safe and secure environment that is conducive to academic and personal achievement."
"1523568745-568","https://knightconnect.campuslabs.com/engage/organizations","https://images.collegiatelink.net/clink/images/3cee20af-db4d-4a4c-aaf6-bfa8177650ac2ca59ded-b168-45e2-a16a-f5abdbb142db.jpg?preset=small-sq","Sigma Chi Fraternity","Sigma Chi is a brotherhood with roots in the collegiate experience that engenders a lifelong commitment to strive to achieve true friendship, equal justice and the fulfillment of learning."
"1523568745-331","https://knightconnect.campuslabs.com/engage/organizations","https://images.collegiatelink.net/clink/images/b2e70406-d4c4-41b1-a8c8-f895faa15a5ffb822abf-d4b7-453b-92b3-c16ce413970f.jpeg?preset=small-sq","Iota Tau Alpha Athletic Training Honor Society","The mission of Iota Tau Alpha Athletic Training Honor Society shall be to function as an honors and professional society for students in the Athletic Training major."
"1523568745-256","https://knightconnect.campuslabs.com/engage/organizations","","F","To recognize and promote high scholastic standards among finance majors while providing targeted mentoring and professional opportunities in finance with emphasis on exposure to Wall Street firms."
"1523568745-508","https://knightconnect.campuslabs.com/engage/organizations","https://images.collegiatelink.net/clink/images/fb1dd926-5b2b-46f4-a578-919c1e32ad78ff6c9461-6292-436f-84d5-f3c778872c8f.jpg?preset=small-sq","Pre-Medical American Medical Student Association","Pre-Med AMSA is one of the only nationally affiliated Pre-Med organization on campus, striving to help our members gain all the knowledge and experience they will need for their application of medical school."
"1523568745-352","https://knightconnect.campuslabs.com/engage/organizations","","K","The mission of the Knight O.W.Ls of BACCHUS is to provide UCF students with health related educational services through training sessions, tabling, and other on-campus and off-campus events."
"1523568745-574","https://knightconnect.campuslabs.com/engage/organizations","https://images.collegiatelink.net/clink/images/84b9857d-5cb9-4235-88bc-57cf3261c320fdf2b412-99b9-4c59-bce1-3723e0230c51.jpg?preset=small-sq","Sigma Pi Fraternity","Sigma Pi Fraternity International"
"1523568745-540","https://knightconnect.campuslabs.com/engage/organizations","https://images.collegiatelink.net/clink/images/c68de9ff-4b34-4d49-93a5-b782f515837a5f128d0b-cf99-4be0-b011-2466eb3402bb.jpg?preset=small-sq","Residence Hall Association","RHA strives to provide residents the UCF experience through programming and leadership opportunities. RHA encourages social and educational development, and advocates for the enhancement of the UCF residential experience."
"1523568745-610","https://knightconnect.campuslabs.com/engage/organizations","","S","Student Care Services (SCS) offers guidance, resources, and referrals to UCF students who are experiencing a distressing situation which significantly impacts academic or personal success."
"1523568745-262","https://knightconnect.campuslabs.com/engage/organizations","https://images.collegiatelink.net/clink/images/7efcb4ea-df76-422f-b49f-16e990c8644826bc838b-1f18-4ac7-9fc8-0a0fd0a7a77b.jpg?preset=small-sq","Flute Club","The UCF Flute Club is an organization within the UCF Music Department comprised of students who have a mutual interest in music, its performance through the flute, as well as the education of music to others."
"1523568745-167","https://knightconnect.campuslabs.com/engage/organizations","","C","The center partners with public- and private-sector community leaders with the intent to develop broad-based community initiatives to address and resolve those pressing concerns."
"1523568745-243","https://knightconnect.campuslabs.com/engage/organizations","","E","The Equestrian Club features three teams: Eventing, Hunt Seat, and Western. While each team is part of the club, they all compete separately. The club meets once a month to discuss horse shows, fundraisers, and volunteering events. We volunteer once a ..."
"1523568745-411","https://knightconnect.campuslabs.com/engage/organizations","https://images.collegiatelink.net/clink/images/6e150246-5781-4a61-b835-41727c73f719cd3fced8-ea88-4e5b-a886-9f2dfb54e749.jpg?preset=small-sq","Men's Volleyball Club @ UCF","The Men's Volleyball Club at UCF provides a competitive volleyball environment for all students to enjoy!"
"1523568745-137","https://knightconnect.campuslabs.com/engage/organizations","https://images.collegiatelink.net/clink/images/2f38173c-4ed0-442a-b4cb-8d1b507d3007dc09bcfd-24c3-4baa-ac63-2b91f9a8cc71.jpg?preset=small-sq","Baptist Collegiate Ministries","BCM (Baptist Collegiate Ministries) is a place for students to explore the claims of Jesus Christ and experience the excitement of answering the call to follow Him."
"1523568745-504","https://knightconnect.campuslabs.com/engage/organizations","","P","We are an organization dedicated to enhancing students' education in the field of ceramics. We provide tools, materials, and workshops for ceramics students."
"1523568745-518","https://knightconnect.campuslabs.com/engage/organizations","https://images.collegiatelink.net/clink/images/97d31525-7292-4ca6-89fa-507540e2a47cb634cf95-9485-419e-aae3-786b19c73738.jpg?preset=small-sq","Project for Haiti Knights","P4HKnights supports sustainable development in Haiti. As an organization we fund raises for our projects and travel to Haiti in order to volunteer our services where needed."
"1523568745-561","https://knightconnect.campuslabs.com/engage/organizations","https://images.collegiatelink.net/clink/images/ef3cb5cf-9afc-48d7-961f-8d74ef8335ef4b68bb17-f883-473a-8310-a3aaabb3a050.jpg?preset=small-sq","Service-Dog Training and Education Program at University of Central Florida","The mission of STEP@UCF is to teach members about puppy care and training, while educating the student body/general public about the disabilities and help that service dogs provide. We complete volunteer activities both on campus and off with CCI."
"1523568745-226","https://knightconnect.campuslabs.com/engage/organizations","https://images.collegiatelink.net/clink/images/9b85b8a3-4289-4807-8fba-2ae1ad4db1980b7ee5bb-38e0-4c3e-af40-30be927e9eb9.jpg?preset=small-sq","Design &amp; Code","To encourage collaboration and learning of web related trends and technologies by offering informative presentations, question and answer sessions, and project work days, to students looking to extend their web design and development education."
"1523568745-395","https://knightconnect.campuslabs.com/engage/organizations","https://images.collegiatelink.net/clink/images/edd3507f-0fae-4465-abe8-5e7d5ea531faa1f9496e-ccfa-444a-9221-7d11c2b39694.jpeg?preset=small-sq","Lemon Club at UCF","Our mission is to raise money and awareness of childhood cancer causes, primarily for research into new
treatments and cures, and to encourage and empower others, especially children, to get involved and make a
difference for children with cancer."
"1523568745-420","https://knightconnect.campuslabs.com/engage/organizations","https://images.collegiatelink.net/clink/images/5a306d39-a207-48a6-93c9-a6afc8904e9c455fc181-1ca2-4e4e-94ad-8fe15d6c37cf.jpg?preset=small-sq","Multicultural Association of Pre-Health Students","Strives to foster a family environment that invites, collaborates, encourages, and educates its members and neighboring community organizations. Our mission is to provide underrepresented students with the knowledge and experience in health care."
