web-scraper-order,web-scraper-start-url,club-image-src,club-name,club-description
"1523568745-607","https://knightconnect.campuslabs.com/engage/organizations","https://images.collegiatelink.net/clink/images/64caa385-58d7-4c13-8965-9a9f3c76eaf672dcea7b-34c9-442a-8382-45998f64d94b.JPG?preset=small-sq","Student Accounting Society","Student Accounting Society is an organization designed to help its members in developing professional skills, utilizing them in weekly interactions with professionals who educate the members about their area of study and networking."
"1523568745-145","https://knightconnect.campuslabs.com/engage/organizations","https://images.collegiatelink.net/clink/images/2130ba00-f040-4249-a7d2-40397880819410e70ec9-875a-413a-8260-b6b175118eb5.jpg?preset=small-sq","Biology Graduate Student Association","To provide opportunities for UCF biology students to participate in extracurricular activities in Biology."
"1523568745-360","https://knightconnect.campuslabs.com/engage/organizations","https://images.collegiatelink.net/clink/images/9535a1ef-d13c-4c9f-b15a-f50afd90867e56d38502-d162-4c67-9724-356b00209a1e.png?preset=small-sq","Knights Cheer","Knights Cheer seeks to give students an opportunity to reconnect with the sport they love while surrounded by fellow knights who share the same passion. To provide an atmosphere that is both competitive and friendly for people of all skill level"
"1523568745-347","https://knightconnect.campuslabs.com/engage/organizations","https://images.collegiatelink.net/clink/images/90fc8ab0-6272-4224-842d-f40f4d3bb4a4fa746e9f-d2df-479e-ba2f-c2d5088632a9.JPG?preset=small-sq","Kendo Club @ UCF","Kendo, meaning ""Way of The Sword"", is a modern Japanese martial art of sword-fighting based on traditional samurai swordsmanship, or kenjutsu. Kendo is a physically and mentally challenging activity that combines strong martial arts values with sport-l..."
"1523568745-365","https://knightconnect.campuslabs.com/engage/organizations","","K","The mission of Knights for Eisenberg is to gain support from, rally and organize students at UCF for the Orange County Commissioner campaign of Gregory Eisenberg."
"1523568745-95","https://knightconnect.campuslabs.com/engage/organizations","https://images.collegiatelink.net/clink/images/a85690bc-b5be-4c8a-9d24-e5f1c782d8544a9b6ae7-9176-45d4-a6e8-dd6e040955e7.jpg?preset=small-sq","American Medical Women's Association","The AMWA seeks to advance women in medicine and improve women's health. We achieve this by providing and developing leadership, advocacy, education, expertise, mentoring, and strategic alliances."
"1523568745-567","https://knightconnect.campuslabs.com/engage/organizations","https://images.collegiatelink.net/clink/images/e93149e4-7bd9-42d7-8b16-bb0bc148b49f2984572f-b0f8-4de7-bab1-68d812d16be7.jpg?preset=small-sq","Sigma Alpha Iota","The Mission of Sigma Alpha Iota International Music Fraternity is to encourage, nurture and support the art of music."
"1523568745-219","https://knightconnect.campuslabs.com/engage/organizations","https://images.collegiatelink.net/clink/images/7f4ff1f5-7c76-4aa4-9417-1db0e3e25bfc288495d2-d615-4a29-94e2-cb8574401096.png?preset=small-sq","Delta Phi Lambda Sorority, Inc","Delta Phi Lambda Sorority, Inc."
"1523568745-79","https://knightconnect.campuslabs.com/engage/organizations","","A","Alpha Epsilon Phi is a national sorority dedicated to helping women become the best they can be. We promote individuality; encouraging each member to discover and develop the talents and abilities that make her unique."
"1523568745-492","https://knightconnect.campuslabs.com/engage/organizations","https://images.collegiatelink.net/clink/images/96408cd4-7663-442b-bd7a-c7fe0c4b6148d2c98a2e-d861-4840-aad1-5002890df587.jpg?preset=small-sq","Phi Sigma Pi National Honor Fraternity","WE'RE RECRUITING! JOIN US FOR RUSH! 
http://www.pspucf.com

Phi Sigma Pi is a gender inclusive, diverse Brotherhood striving to work together in a spirit of excellence towards Leadership, Fellowship, and Scholarship."
"1523568745-509","https://knightconnect.campuslabs.com/engage/organizations","https://images.collegiatelink.net/clink/images/81509f6c-d4ab-42d1-a4ac-406dc4986673286197ed-08ad-4a8c-9c2e-725e492fbdaa.png?preset=small-sq","Pre-Occupational Therapy Organization","The mission of Pre-Occupational Therapy Organization is to unite students interested in occupational therapy as a career while providing opportunities to be involved in this health community and gain knowledge and experience in the health care profession"
"1523568745-78","https://knightconnect.campuslabs.com/engage/organizations","https://images.collegiatelink.net/clink/images/3bdadb92-e4d4-41f1-9ddc-31003e5592333c526d22-35e4-4ec1-b4d6-30543e38ddaf.jpg?preset=small-sq","Alpha Delta Pi Sorority","Alpha Delta Pi was the first secret society for college women in the world. Established at Wesleyan College in Macon, Georgia, the first college chartered to grant degrees to women, we were originally named “The Adelphean Society”."
"1523568745-67","https://knightconnect.campuslabs.com/engage/organizations","https://images.collegiatelink.net/clink/images/3b44c0c1-100d-4739-ac5d-83ae89dafa9a39cca255-4fe6-46d0-97c3-db42bfc77fcd.jpg?preset=small-sq","4EVER KNIGHTS","To enable students to combine networking and career planning with fun, exciting social opportunities, not only with other students, but with alumni as well. The official Student Alumni Association at UCF."
"1523568745-206","https://knightconnect.campuslabs.com/engage/organizations","https://images.collegiatelink.net/clink/images/fdcfee3b-aab3-4eff-aa03-7d54455862ca62d9e516-1c44-4cb8-905f-a72e3be8fb6b.png?preset=small-sq","Crown to Crown","The mission of Crown to Crown is to create a sisterhood of excellence through mentorship with young girls in our community by providing valuable insight, support, and friendship to encourage self-love, empowerment, and achievement."
"1523568745-168","https://knightconnect.campuslabs.com/engage/organizations","","C","The Central Florida Trumpet Guild is committed to educating the students and the community in the art of trumpet. The CFTG host the UCFs trumpet fest which brings in artists to perform and educate the masses on the art and skill that is the trumpet."
"1523568745-122","https://knightconnect.campuslabs.com/engage/organizations","https://images.collegiatelink.net/clink/images/591ba404-0067-4645-a029-e9f47d1692f355ae1c03-eebc-4e4f-81b9-85181020a5c3.jpg?preset=small-sq","Association of Certified Fraud Examiners Student Chapter","The Association of Certified Fraud Examiners Student Chapter at the University of Central Florida provides students with opportunities to develop education, research, leadership, and networking skills in the field of fraud examination."
"1523568745-392","https://knightconnect.campuslabs.com/engage/organizations","","L","The mission of the Department of Housing and Residence Life is to provide students living in university housing with a safe and secure environment that is conducive to academic and personal achievement."
"1523568745-210","https://knightconnect.campuslabs.com/engage/organizations","https://images.collegiatelink.net/clink/images/55db8ffd-2858-472f-9c84-b661fb12b05f008b53e0-6c60-48b8-a2dc-1c8a510dca56.png?preset=small-sq","Cupcakes for a Cure","Cupcakes for a Cure is a UCF RSO that focuses on brightening the childhoods of pediatric cancer patients and their siblings."
"1523568745-198","https://knightconnect.campuslabs.com/engage/organizations","","C","This organization functions to bring students together in unity and fellowship, and bring its members closer to Christ, the Church, and the community, all while experiencing an ancient orthodox tradition."
"1523568745-324","https://knightconnect.campuslabs.com/engage/organizations","https://images.collegiatelink.net/clink/images/bf08abaa-284b-4860-999d-064d100191edbc84a20b-030f-48f9-9ca7-a10cfabd7ef5.jpg?preset=small-sq","International Association of Hydro-Environment Engineering and Research","Involve students in the international research community for fluid mechanics; hydraulics; hydrology; water resources & environmental engineering (hydroscience) to broaden their knowledge and enable affiliates to gain experience and network..."
"1523568745-459","https://knightconnect.campuslabs.com/engage/organizations","https://images.collegiatelink.net/clink/images/cdb31919-bb75-4831-8d41-a8dfb0aa4c7e8ea6d798-1f15-4a08-8839-6f992312c95b.jpg?preset=small-sq","Omega Phi Alpha National Service Sorority","""Today's friends, tomorrow's leaders, forever in service."""
"1523568745-510","https://knightconnect.campuslabs.com/engage/organizations","https://images.collegiatelink.net/clink/images/64fee630-d7dc-4520-85a1-49081419e475d8bd273d-9f5d-4b88-9de9-89332a119e0f.jpg?preset=small-sq","Pre-Optometry Association","The mission of the Pre-Optometry Association is to prepare students to delve into the eyes of the optometry profession, while establishing an understanding of the application process, the Optometry Admission Test (OAT), views from the doctor’s standpoint"
"1523568745-453","https://knightconnect.campuslabs.com/engage/organizations","","N","The mission of the Department of Housing and Residence Life is to provide students living in university housing with a safe and secure environment that is conducive to academic and personal achievement."
"1523568745-247","https://knightconnect.campuslabs.com/engage/organizations","https://images.collegiatelink.net/clink/images/d7fa03da-0990-412f-bafd-824f68fb205af1752572-b1f5-4dfd-8e47-8fd4b1ac6ad9.jpg?preset=small-sq","Every Nation Campus","​Every Nation Campus at the University of Central Florida"
"1523568745-345","https://knightconnect.campuslabs.com/engage/organizations","https://images.collegiatelink.net/clink/images/ab008a57-40e1-4000-be29-1437210f0eb2c5dd6c00-3528-41ca-8ca6-e6408f72be2a.png?preset=small-sq","Kappa Kappa Psi National Honorary Band Fraternity","To Lead, To Serve, To Honor, To Strive."
"1523568745-408","https://knightconnect.campuslabs.com/engage/organizations","https://images.collegiatelink.net/clink/images/5daf9684-e84d-4a45-b36e-98ec1a285cad7ec99917-98da-4dc6-aa53-187c9ca40b29.png?preset=small-sq","Men's Lacrosse Club @ UCF","Lacrosse"
"1523568745-358","https://knightconnect.campuslabs.com/engage/organizations","","K","The mission of KAPM is to educate students about the profession of project management and provide unique opportunities to gain experience on campus and around the community."
"1523568745-611","https://knightconnect.campuslabs.com/engage/organizations","","S","The mission of the StudentCPT is to promote ethical thinking in the developing character and conscience of students. The StudentCPT will provide students with the opportunity to develop a real awareness of ethical issues"
"1523568745-554","https://knightconnect.campuslabs.com/engage/organizations","https://images.collegiatelink.net/clink/images/05def24d-2035-4ed5-822a-e3ed3832b320f7fe7828-7002-4038-a969-597a747c4b5e.jpg?preset=small-sq","Russian Club","The Russian Club serves to provide a group for those interested in the Russian Language and Culture."
"1523568745-216","https://knightconnect.campuslabs.com/engage/organizations","https://images.collegiatelink.net/clink/images/29335b71-d56e-46bb-88e5-653c3944009a7d3c16b5-ce70-47a5-9cd7-8fa075c58552.jpg?preset=small-sq","Delta Epsilon Iota Academic Honor Society","Founded in 1994 at the University of Georgia, DEI recognizes academic excellence and provides members with a forum for leadership, community service, and valuable insight into career development issues."
"1523568745-191","https://knightconnect.campuslabs.com/engage/organizations","https://images.collegiatelink.net/clink/images/73c3a81b-e503-4e52-be71-19c1a296feb068408662-25ac-445f-a101-69ced7b47398.jpg?preset=small-sq","Collegiate DECA","To provide leadership,educational, and professional development opportunities for its members and to promote student interest and involvement in the Collegiate DECA sponsored competitions and conferences."
"1523568745-131","https://knightconnect.campuslabs.com/engage/organizations","https://images.collegiatelink.net/clink/images/c266a305-3c04-4186-86a3-cdae3c26391409deacd4-cb3c-461c-b160-1550268e3113.jpg?preset=small-sq","Bachelor of Social Work Student Association","The Bachelors of Social Work Student Association promotes the field of social work by enhancing the lives of individuals, families, and communities through community service and social interactions."
"1523568745-186","https://knightconnect.campuslabs.com/engage/organizations","https://images.collegiatelink.net/clink/images/5611f954-5da3-42f7-8671-6345983ce506c7cf26e5-a19d-463a-8b69-a7e5deba0f62.jpg?preset=small-sq","Coaching Corps","We are a Corps of motivated college students and community members who serve as volunteer coaches, mentors and role models in afterschool sports programs serving girls and boys who live in some of our most under-resourced communities."
"1523568745-597","https://knightconnect.campuslabs.com/engage/organizations","https://images.collegiatelink.net/clink/images/306a6a28-600d-47c1-b0d1-34a4761a7dfe720151f0-23d0-4610-9376-28804a3feb9d.jpg?preset=small-sq","Special Olympics College Club","The mission of Special Olympics College Club is to connect college students and individuals with intellectual and/or physical exceptionalities through sports and to build friendships and help lead the social justice
movement of Special Olympics."
"1523568745-418","https://knightconnect.campuslabs.com/engage/organizations","https://images.collegiatelink.net/clink/images/3cfcc211-8622-4ff6-8438-4658a1ec18c37100be76-ee7b-455e-bf46-d74867756950.jpg?preset=small-sq","Mu Sigma Upsilon Sorority","Mu Sigma Upsilon Sorority, Inc. was founded on November 21, 1981 as the first Multicultural Sorority in the nation. This organization is comprised of women from various ethnic backgrounds, races, religions and creeds."
"1523568745-316","https://knightconnect.campuslabs.com/engage/organizations","https://images.collegiatelink.net/clink/images/0a31d4e7-2844-43d2-bc18-ddceeba15d6fd2db82cf-c5cd-4a31-b653-0f375204b5b6.jpg?preset=small-sq","Institute of Electrical and Electronic Engineers","To advance global prosperity by promoting the engineering process of creating, developing, integrating, sharing, and applying knowledge for the benefit of humanity and the profession."
"1523568745-162","https://knightconnect.campuslabs.com/engage/organizations","https://images.collegiatelink.net/clink/images/dc1bf08e-63b9-454d-89d1-105be95c137702a6dfef-6122-4675-9efd-84b8e40aaeb0.jpg?preset=small-sq","CAPS Peer Educators","CAPS Peer Educators are a group of student volunteers from all years and majors. We are here to promote UCF’s Counseling and Psychological Services to students and campus departments."
"1523568745-188","https://knightconnect.campuslabs.com/engage/organizations","https://images.collegiatelink.net/clink/images/72837b78-f1b0-42af-b638-b91347f2b3dfd2714a5f-aa57-4465-be75-fa41ee1faa66.png?preset=small-sq","College Republicans","The mission of the College Republicans is to recruit, train, mobilize, and engage college-aged students on the campus of the University of Central Florida to win the battle of ideas and elections for the Republican Party."
"1523568745-150","https://knightconnect.campuslabs.com/engage/organizations","https://images.collegiatelink.net/clink/images/29b94f0f-f77f-4d7e-ba38-a3bd9c0bdda808760372-6b16-4a67-ae60-5e1fa71f124a.png?preset=small-sq","Black Student Union","We are the Black Student Union at the University of Central Florida. Our purpose is to serve as the official voice for the black community on campus."
"1523568745-602","https://knightconnect.campuslabs.com/engage/organizations","https://images.collegiatelink.net/clink/images/2e1ab122-c42b-4d7f-8df4-fc5d66bccb98def8975b-10fe-499f-9ef4-4bd3b3d06cbc.jpg?preset=small-sq","Sport Club Fans","The Sport Club Fans group is for all friends, family members, alumni, and anyone else that is a fan of our sport clubs!"
"1523568745-74","https://knightconnect.campuslabs.com/engage/organizations","https://images.collegiatelink.net/clink/images/fa095136-9a7e-4b34-b4fd-39b3a9d3d332142cc12f-9dd5-43b5-9506-11defd26d8fb.jpg?preset=small-sq","Advertising Club","Ad Club is a student-run organization intended to give students an opportunity to learn about the field of advertising. We bring in speakers, visit agencies and network with Orlando professionals. We also hold socials so we get to know our peers."
"1523568745-97","https://knightconnect.campuslabs.com/engage/organizations","https://images.collegiatelink.net/clink/images/510df775-c243-426f-be6e-b24743dc4e843d8e2e74-dbd8-41aa-ae54-8eab1cbec4bc.jpg?preset=small-sq","American Sign Language Club","An exciting place to make new friends and learn American Sign Language and Deaf Culture, we're open to the beginner and advanced signer alike! Whether you are just learning your ABC's, or are a seasoned signer, we welcome YOU!"
"1523568745-155","https://knightconnect.campuslabs.com/engage/organizations","https://images.collegiatelink.net/clink/images/af93de3c-96d8-4e77-b83f-3514bd2024f5e162895a-9ae0-41d9-9333-f3e74cb57d2e.jpg?preset=small-sq","Bridges International","Bridges International is a caring, multiethnic student community that engages with international students by providing service activities, social networking, and spiritual resources."
"1523568745-583","https://knightconnect.campuslabs.com/engage/organizations","https://images.collegiatelink.net/clink/images/da8beda2-9460-40ed-ae29-7caf8017c72bf896fdb0-2d6d-4e9c-a73b-fa10096a225b.jpg?preset=small-sq","Society for the Advancement of Minorities in STEM","To provide a support system ensuring the success of members in academia, encourage and make graduate school accessible to Hispanics/ Chicanos, Native Americans, and other underrepresented minorities in science."
"1523568745-118","https://knightconnect.campuslabs.com/engage/organizations","https://images.collegiatelink.net/clink/images/87788780-362c-4567-9111-a2b8ab44b89083374e34-1ede-4240-822c-b2ac23e91140.png?preset=small-sq","Association for Computing Machinery","ACM  is an international scientific and educational organization advancing computer science. The on-campus chapter offers events ranging from tutorials on programming topics to technical interview workshops."
"1523568745-213","https://knightconnect.campuslabs.com/engage/organizations","https://images.collegiatelink.net/clink/images/0ccba62e-f17a-439a-a8d4-b65b9c1670049c03b6fb-c8a6-4c8f-9ed4-a678e8d66a7f.png?preset=small-sq","D20 Knights","To promote creativity, critical thinking and communication skills through the practice and enjoyment of Tabletop gaming."
"1523568745-335","https://knightconnect.campuslabs.com/engage/organizations","","J","The Japanese Culture Club welcomes the Knights community to come together to appreciate a deeply rich culture. Members will gain invaluable insight into Japanese history, pop culture, and language."
"1523568745-163","https://knightconnect.campuslabs.com/engage/organizations","https://images.collegiatelink.net/clink/images/3f7a0184-9239-4eac-be6f-1f7c97bda22d412a9ac1-e5c9-4da2-8d99-5911139d84bc.jpeg?preset=small-sq","Car Club","We strive to provide a haven for automotive enthusiasts of all kinds and benefit the surrounding community through the collaboration of automotive interests! Join our FB for upcoming events: www.facebook.com/groups/carclubatucfofficial"
"1523568745-429","https://knightconnect.campuslabs.com/engage/organizations","https://images.collegiatelink.net/clink/images/fbc2e083-53ee-438d-a680-9eeb115c9471ee20d9cc-c42f-4c8f-9b6a-a7ce18ddcc48.png?preset=small-sq","National Broadcasting Society","UCF's National Broadcasting Society enhances the development of college students preparing for careers in electronic media industries. Our focus is to develop production/broadcast skills, connect students with professionals and promote excellence."
"1523568745-470","https://knightconnect.campuslabs.com/engage/organizations","https://images.collegiatelink.net/clink/images/cc67f219-cb23-4202-87f3-abf4f89fb21b31f65d5a-26af-4f15-b64a-c9893d0a60c3.jpg?preset=small-sq","Out of State Student Mentoring","OSSM (pronounced ""awesome"") is the Out of State Student Mentoring program at UCF. All first year Out-of-State students are members of the program and each student is paired with an OSSM Mentor! 

OSSM hosts many events including trips to Disney!"
"1523568745-613","https://knightconnect.campuslabs.com/engage/organizations","https://images.collegiatelink.net/clink/images/c13e290d-3ae3-488b-ae9b-127cccd9b4f8c9a33be3-8a97-44ed-bfa5-4513bd0c7e32.jpg?preset=small-sq","Student Government Association - Election Commission","The Election Commission serves to promote and facilitate the fall (Senate) and spring (Presidential) elections for the Student Government Association."
"1523568745-452","https://knightconnect.campuslabs.com/engage/organizations","https://images.collegiatelink.net/clink/images/b50b1d76-621d-4efb-8bb9-65415461db3aada4f63d-bef8-4902-9abc-4fb2cf0654b3.jpg?preset=small-sq","Northview Area Council","The mission of the Department of Housing and Residence Life is to provide students living in university housing with a safe and secure environment that is conducive to academic and personal achievement."
"1523568745-417","https://knightconnect.campuslabs.com/engage/organizations","https://images.collegiatelink.net/clink/images/c8c7d207-cbf5-4d44-bb06-13582fe9a82d42551737-6059-4e8e-91cb-15ad35b5c78f.png?preset=small-sq","Motorcycle Club","The mission of the Knight Riders  Club is to bring unity among motorcycle riders and enthusiasts in the UCF community."
"1523568745-547","https://knightconnect.campuslabs.com/engage/organizations","https://images.collegiatelink.net/clink/images/ba415cc8-c5b3-4a9c-8269-a227abc5627bf3032c64-8860-4043-beeb-fad41662206e.png?preset=small-sq","Rosen Entertainment Management Society","The mission of Rosen Entertainment Management Society is to provide UCF’s Rosen College Students with hands-on experiences in the entertainment management industry."
"1523568745-212","https://knightconnect.campuslabs.com/engage/organizations","https://images.collegiatelink.net/clink/images/30a638d3-63f6-475d-8ca0-3d2ea7637c063bf196ad-1955-4f10-a188-3fe9223ca494.jpg?preset=small-sq","Cypress Dome Society","The Cypress Dome is a student-produced literary journal that publishes creative writing and visual art by University of Central Florida students."
"1523568745-421","https://knightconnect.campuslabs.com/engage/organizations","https://images.collegiatelink.net/clink/images/27e5f9fb-1b0c-4790-8fd7-9e2e7b07eb7f63721497-cf77-4971-abf7-c15cf339a30a.png?preset=small-sq","Multicultural Psychological Student Association","The Multicultural Psychological student association allows students of different cultures and diverse disciplines to come together under one common interest, psychology. Anyone interested in the field of psychology is welcomed to join."
"1523568745-232","https://knightconnect.campuslabs.com/engage/organizations","https://images.collegiatelink.net/clink/images/6f7448de-dfc4-485a-b53c-87e5e2673557274f7082-80fa-4215-93ff-8f0e12e38bf4.png?preset=small-sq","Don't Shop, Adopt","The mission of Don’t Shop, Adopt is to increase the adoption rates in the Orlando community through educational outreach, fundraising, and service."
"1523568745-585","https://knightconnect.campuslabs.com/engage/organizations","https://images.collegiatelink.net/clink/images/996c8add-fa57-4f86-b22a-c5a6eb31c1597878076c-3726-49db-ae63-2befa90f4c99.jpg?preset=small-sq","Society of Emerging Nanotechnology","The mission of Society of Emerging Nanotechnology is to raise awareness of current research and potential applications of nano and emerging technologies"
"1523568745-556","https://knightconnect.campuslabs.com/engage/organizations","https://images.collegiatelink.net/clink/images/31e7df61-56f8-4ece-a7d9-df8124b365c3371a9846-6ee7-4484-b0f8-ff03cfad205e.JPG?preset=small-sq","Saudi Students Association","The mission of the Saudi Student Association (SSA) is to promote knowledge and awareness of Saudi culture through cultural and social forum within UCF community and within the greater Orlando area."
"1523568745-112","https://knightconnect.campuslabs.com/engage/organizations","","A","To build a network with people that are passionate about animation and art, learn about the different processes of animation and the tools needed to create them, and establish fellowship with other creative organizations."
"1523568745-457","https://knightconnect.campuslabs.com/engage/organizations","","O","Our goal is to provide students at UCF the opportunity to expand their officiating skills within the Orlando area as well as providing UCF and outside organizations quality officials."
"1523568745-440","https://knightconnect.campuslabs.com/engage/organizations","https://images.collegiatelink.net/clink/images/dec4cf07-85d5-4858-8fb4-b8744d54d4d18caf7a4a-2a7c-402d-89af-c7ea91337b29.jpg?preset=small-sq","National Society of Minorities in Hospitality","The National Society of Minorities in Hospitality at UCF is a student-run organization that promotes the professional advancement of minority students in the hospitality industry through developmental programs. All students are welcome!"
"1523568745-310","https://knightconnect.campuslabs.com/engage/organizations","","H","We are the UCF Student chapter of HFES.  Our goal is to facilitate discussion of our discipline, assist students with professional development, disseminate information, and to increase awareness of human factors and ergonomics."
