web-scraper-order,web-scraper-start-url,club-image-src,club-name,club-description
"1523568745-160","https://knightconnect.campuslabs.com/engage/organizations","https://images.collegiatelink.net/clink/images/33feb550-0123-4576-a7b8-84753290b802cf3f8277-1d3d-4907-9c24-2638151ef0f9.png?preset=small-sq","Campus Crusade for Christ","We are a welcoming community of students and faculty that know Jesus and want him to be known."
"1523568745-183","https://knightconnect.campuslabs.com/engage/organizations","https://images.collegiatelink.net/clink/images/80713faf-f4f7-495b-861a-d101fc238ba36b0bfd29-4e8f-4d9b-a6bb-b8a80ce8455a.png?preset=small-sq","Circle K International","Circle K International (CKI) is the premier collegiate and university community service, leadership development, and fellowship organization in the world.
Meetings are on Wednesdays at 6:00 PM in Student Union Room 220 for Spring 2018!"
"1523568745-536","https://knightconnect.campuslabs.com/engage/organizations","https://images.collegiatelink.net/clink/images/2ffdf5ec-0ad9-4281-b5de-25ffa1a24bfda25521c3-d5d3-4442-b479-5514d03e760c.jpg?preset=small-sq","Reel Knights","The UCF Fishing Club, a club of fishermen and women of all levels.  Joining a club allows UCF's large student body feel a little smaller while making friends with similar interests.  Join us on Facebook: Reel Knights at UCF."
"1523568745-110","https://knightconnect.campuslabs.com/engage/organizations","","A","The mission of the Department of Housing and Residence Life is to provide students living in university housing with a safe and secure environment that is conducive to academic and personal achievement."
"1523568745-171","https://knightconnect.campuslabs.com/engage/organizations","https://images.collegiatelink.net/clink/images/d21314bc-29a7-4223-9c97-f6191b453b2e93e2c8d5-36d2-40f1-af13-dfda2a51c536.jpg?preset=small-sq","CHAARG at UCF","We are CHAARG + we’re on a mission to show college girls everywhere that owning your fitness is owning your life. We are liberating girls from the elliptical + proving that fitness can + should be fun."
"1523568745-223","https://knightconnect.campuslabs.com/engage/organizations","https://images.collegiatelink.net/clink/images/30c3660d-9fc6-4043-9191-38fe7ad9ce6ef4a81db6-a67c-4be6-bf54-9bd6e5d7084f.jpg?preset=small-sq","Delta Sigma Theta Sorority, Inc.","Delta Sigma Theta Sorority, Inc. is a private, non-profit organization whose purpose is to provide assistance and support through established programs in local communities throughout the world."
"1523568745-511","https://knightconnect.campuslabs.com/engage/organizations","https://images.collegiatelink.net/clink/images/3fd7d6c6-d2d9-407b-bbf7-55c74e4f479f87d76a97-5a17-4787-aca9-8ce8a3e953a1.jpg?preset=small-sq","Pre-Pharmacy Society","The mission of the PrePharmacy Society at UCF is to promote communications between PrePharmacy students.This society will stimulate interest in the different aspects of the pharmacy profession with guest speakers, tours, and discussion of graduate school"
"1523568745-239","https://knightconnect.campuslabs.com/engage/organizations","https://images.collegiatelink.net/clink/images/d692c895-7ce9-4d66-9277-deb82cbcd644349d2cb7-6737-4610-b8db-9c91fbf4dd46.png?preset=small-sq","Emerging Urban Knights Planning Association","The mission of the Emerging Urban Knights Planning Association is to bring together students, faculty and planning professionals to network and create ideas for planning urban environments."
"1523568745-114","https://knightconnect.campuslabs.com/engage/organizations","https://images.collegiatelink.net/clink/images/d9d4427f-0ec9-42db-b91b-0c1b0093f8b15bdaeeb0-8dae-47d2-830f-bc38ce6d14b7.jpg?preset=small-sq","Art History Club","To spread love and joy of the arts, as well as to inform and excite people about Art History and provide studying strategies for UCF Art History classes. For more information visit www.facebook.com/arthistoryUCF"
"1523568745-81","https://knightconnect.campuslabs.com/engage/organizations","https://images.collegiatelink.net/clink/images/a42fb65d-404d-465f-ae32-c61b45c503e02174427a-c209-496b-bea9-67931447b84c.jpg?preset=small-sq","Alpha Kappa Alpha Sorority, Inc.","Founded January 15, 1908, Alpha Kappa Alpha continues to strive for service to all mankind."
"1523568745-409","https://knightconnect.campuslabs.com/engage/organizations","","M","This is the Offical OrgSync Page of the UCF Men's Rugby Club."
"1523568745-258","https://knightconnect.campuslabs.com/engage/organizations","https://images.collegiatelink.net/clink/images/7a0eef7e-228e-4323-9c13-dc1fddeece8fdaabed9d-45ea-412b-95e3-4ae58aae82b9.jpg?preset=small-sq","First Generation American Knights","The mission of FGA Knights is to empower young minds for a brighter future."
"1523568745-302","https://knightconnect.campuslabs.com/engage/organizations","https://images.collegiatelink.net/clink/images/ebe5e983-bcb9-4a65-bf5c-a65856f9537171011ec4-ce75-4b89-b261-33fd2bf1d7c5.png?preset=small-sq","Her Campus","Her Campus is the #1 online community for college women.  Written entirely by the nation’s top college journalists – with 3,000+ contributors and counting – HerCampus.com features national content on Style, Health, Love, Life, and Career."
"1523568745-194","https://knightconnect.campuslabs.com/engage/organizations","","C","The UCF Collegiate Percussive Arts Society is dedicated to fostering the highest quality percussion students through clinics, improved rehearsal facilities, and technological advances."
"1523568745-287","https://knightconnect.campuslabs.com/engage/organizations","","G","The mission of GWA is to help students successfully transition from the university into the changing literary field by their creating and participating in enhanced networking and professional development opportunities and sharing knowledge of existing li"
"1523568745-361","https://knightconnect.campuslabs.com/engage/organizations","","K","To provide a residence life program that encourages a positive living and learning environment, supportive of students' development in the college community by providing quality opportunities and connections for academic and personal growth."
"1523568745-400","https://knightconnect.campuslabs.com/engage/organizations","https://images.collegiatelink.net/clink/images/890aa37b-00ae-4c7f-9df4-fd6d1927a4138a0acb37-bdb6-4259-b9c8-2b9330010255.jpg?preset=small-sq","Live Ministries","The mission of Live Ministries is to gather UCF students together for worship and fellowship and to send them back out to be a blessing to the UCF community.
Living for Christ. Loving UCF."
"1523568745-170","https://knightconnect.campuslabs.com/engage/organizations","https://images.collegiatelink.net/clink/images/6c53964c-4b05-4c1f-a28c-ac57057baa04311ef8e4-90b1-4ebe-b9d5-b4151a559ee7.jpg?preset=small-sq","CEO Knights","The purpose of the club is to foster interest in entrepreneurship, whether that be starting a for profit or non-profit business entity, or starting another organization. We foster a community of entrepreneurs along with providing valuable resources"
"1523568745-240","https://knightconnect.campuslabs.com/engage/organizations","https://images.collegiatelink.net/clink/images/9bab9915-3667-4f61-be64-c1326d393b5d73d7fb2b-993b-4f0f-9f16-512b2d12df0d.png?preset=small-sq","Energy Knights","Energy Knights will aim to provide UCF students the opportunity to take part in projects that revolve around power and energy. We strive to arrange connections between industry professionals and members to sharpen their passions for power and energy and"
"1523568745-281","https://knightconnect.campuslabs.com/engage/organizations","","G","The Golf Club at UCF will strive to create an environment where students of all skill levels can learn, develop, practice and compete while simultaneously offering opportunities to grow personally and professionally through the game of golf."
"1523568745-282","https://knightconnect.campuslabs.com/engage/organizations","","G","The mission of the Graduate Anthropology Association is to provide a setting where students can discuss current research topics in Anthropology and assist fellow classmates in conducting graduate level research."
"1523568745-288","https://knightconnect.campuslabs.com/engage/organizations","https://images.collegiatelink.net/clink/images/2238fd27-b002-48c9-8720-2de7bad0cb6a3ddbbd57-b4d9-4463-a37d-54e56a6ed430.jpg?preset=small-sq","Graphic Design Student Association","Meeting on Wed. at 5:30 PM, BA 135. GDSA is a collaboration group that aims to strengthen the presence of UCF designers, illustrators, photographers and other creatives in the local community."
"1523568745-214","https://knightconnect.campuslabs.com/engage/organizations","","D","Delight seeks to establish a college community that grows together, serves together, learns together, and does life together while chasing the heart of God."
"1523568745-261","https://knightconnect.campuslabs.com/engage/organizations","","F","To promote an all inclusive Martial Arts culture to improve physical, spiritual & mental self-being through the application of modern and traditional practices, not limited to one particular style."
"1523568745-297","https://knightconnect.campuslabs.com/engage/organizations","https://images.collegiatelink.net/clink/images/6b51b520-655c-4cfe-a22f-2bf67a0363af028af716-ccfe-42ec-80f8-8888c04a2cc1.jpg?preset=small-sq","Health Awareness and Prevention Society","The mission of Health Awareness and Prevention Society (H.A.P.S) exists to promote a healthy lifestyle by increasing awareness and healthy living through education and preventative measures."
"1523568745-69","https://knightconnect.campuslabs.com/engage/organizations","https://images.collegiatelink.net/clink/images/435e6eed-a775-40c4-95a1-62f837a6e7978299c8f3-f1f1-489f-bcce-cf7e482e62fa.jpg?preset=small-sq","Access at UCF","The mission of Access at UCF is to advocate for Safe Accessibility and to support inclusion to members and non-members of those living with disabilities by advocating for a Community environment with the UCF community."
"1523568745-222","https://knightconnect.campuslabs.com/engage/organizations","https://images.collegiatelink.net/clink/images/0f98f295-06ba-412e-b1b7-acc821b4504e27480dbe-260c-4388-be7a-e094a90e7d49.jpg?preset=small-sq","Delta Sigma Pi Professional Business Fraternity","Delta Sigma Pi is a professional fraternity organized to foster the study of business in universities; to encourage scholarship, social activity and the association of students for their mutual advancement by research and practice."
"1523568745-563","https://knightconnect.campuslabs.com/engage/organizations","https://images.collegiatelink.net/clink/images/44f2ced5-a927-42ca-8ebb-ebd37e382e71723c7097-16e2-40ee-89eb-d0fe20b795d5.png?preset=small-sq","She's the First","We are the UCF chapter of She's the First, a not-for-profit organization that sponsors girls' education in low-income countries."
"1523568745-374","https://knightconnect.campuslabs.com/engage/organizations","https://images.collegiatelink.net/clink/images/dcb63b52-50f7-4791-8361-7381c1f12c0fd91fb474-3fbc-4258-85e5-ef4c611b9fc4.png?preset=small-sq","Knights of the Connection","KotC is a unique entity that focuses on the specific needs of the individual regions, campuses, and students that it serves. UCF regional campuses, Rosen College of Hospitality Management, the College of Medicine, as well as Graduate Knights."
"1523568745-350","https://knightconnect.campuslabs.com/engage/organizations","https://images.collegiatelink.net/clink/images/c4746262-0abe-46e3-9dc5-cc038885530daeffe233-5c00-4c9c-978d-2303be4edcec.png?preset=small-sq","Knight Camp","Knight Camp is a unique UCF experience built to immerse incoming students into the UCF culture as well as prepare them for the excitement of being a Knight. Knight Camp creates friends and memories of a lifetime, personal growth and all Knight fun!"
"1523568745-424","https://knightconnect.campuslabs.com/engage/organizations","https://images.collegiatelink.net/clink/images/03688044-cd23-4026-8353-d2f0c202a0e1104d9392-4211-47c3-b30b-c6b204729113.jpg?preset=small-sq","National Art Education Association Student Chapter","The National Art Education Association Student Chapter is a club geared towards UCF's Art Education majors. We do everything from professional development to actually creating art. We continue to inspire the younger generations through art in school!"
"1523568745-377","https://knightconnect.campuslabs.com/engage/organizations","https://images.collegiatelink.net/clink/images/70ddca0c-a087-4a84-9ea8-1d4a14db2a990bf67c1f-74d7-4d0b-ba17-43fc7d99577e.png?preset=small-sq","Knights Overseas","Our mission is a force of empowerment through education – fundraising/supporting communities of impoverished nations, whose children are unable to afford such scholarship and in spreading awareness of education/economic disparities worldwide."
"1523568745-132","https://knightconnect.campuslabs.com/engage/organizations","https://images.collegiatelink.net/clink/images/1fdad247-4ddc-437d-a072-b3beeb0dcafac6bdb7b7-c7da-40ac-978d-264a3a364ada.jpg?preset=small-sq","Badminton Club @ UCF","Badminton Club is dedicated to students who either have a continuing interest in badminton, or would like to unwind by trying a new sport. The club is open to anyone. Students who wish to come are free to play the sport with friends on their own, or ma..."
"1523568745-384","https://knightconnect.campuslabs.com/engage/organizations","https://images.collegiatelink.net/clink/images/e4723c7c-d47f-4af8-be6d-bbae377b55371b0358a2-bee9-46fa-86a0-8b3783317576.jpg?preset=small-sq","Lambda Theta Alpha Latin Sorority, Inc.","Lambda Theta Alpha is the first Latin sorority in the nation. LTA prides itself on being an academic sorority based on the principles of unity, love, and respect. Since their founding in 1975, their mission has been the empowerment of women!"
"1523568745-320","https://knightconnect.campuslabs.com/engage/organizations","https://images.collegiatelink.net/clink/images/8960aed4-3ed0-48f8-a474-b120a8e453adce91a3f3-da31-4fb7-b59f-29bcf5b6277a.PNG?preset=small-sq","Integrated Business Professional Association","Promoting an integrated culture of professionalism, collaboration, problem solving, and risk taking to help business students today become the leaders of tomorrow."
"1523568745-465","https://knightconnect.campuslabs.com/engage/organizations","https://images.collegiatelink.net/clink/images/c7b33b1e-be80-4a35-bf47-72f82c2e16ef0e903d66-61f5-4cd2-abdb-6d9432ef3b40.jpg?preset=small-sq","Organization for Public Administration","The Organization for Public Administration (OPA) is a registered student organization open to all students at UCF. Events held by OPA will be geared towards enhancing the professional careers of students interested in the field of Public Administration"
"1523568745-231","https://knightconnect.campuslabs.com/engage/organizations","","D","The mission of the Dodgeball Club at UCF is to promote the sport of Dodgeball on the UCF campus in a competitive manner."
"1523568745-558","https://knightconnect.campuslabs.com/engage/organizations","https://images.collegiatelink.net/clink/images/1c8e0c65-86d3-4507-9b33-6d0cfcddeb3cdf5f05f8-9f2b-4d5d-83c2-982d7c3a2881.jpg?preset=small-sq","Saxophone Collegium","Mission: To  provide leadership, community involvement, and educational opportunities for its members and to promote student  interest  and  involvement  in  the  Saxophone  Collegium's  sponsored program meetings and festivals."
"1523568745-415","https://knightconnect.campuslabs.com/engage/organizations","https://images.collegiatelink.net/clink/images/d0dd00e6-4608-4651-942f-99adfe7d4d92755acfea-ba61-47e3-ad48-7ce0af881f4f.PNG?preset=small-sq","Modeling and Simulation Knights","MaSK (Modeling and Simulation Knights) is a graduate student organization for Modeling and Simulation students at UCF to collaborate, network, and socialize. We will have at least one event per month."
"1523568745-135","https://knightconnect.campuslabs.com/engage/organizations","","B","The mission is to allow a place for Bangladeshis to find others like them while at the same time making others aware of the cultures and traditions of the Bangladeshi community"
"1523568745-72","https://knightconnect.campuslabs.com/engage/organizations","https://images.collegiatelink.net/clink/images/5f1968a3-b018-40f5-952f-3d5f72fb8b71402beaaa-566b-451a-8285-005a81fd8e40.jpg?preset=small-sq","Actuarial Science Club","To provide support and fellowship for students interested in pursuing a career in the field of actuarial science."
"1523568745-306","https://knightconnect.campuslabs.com/engage/organizations","","H","To work toward the diversification of faculty and students in Schools and Colleges of Education and of K-12 teachers and administrators."
"1523568745-93","https://knightconnect.campuslabs.com/engage/organizations","https://images.collegiatelink.net/clink/images/ea0e8d64-940e-4a3e-b038-d6d9743f24e013db4c8d-cde8-4310-a568-f3a5f7942df3.png?preset=small-sq","American Institute of Aeronautics and Astronautics","To broaden the horizons of students interested in Aerospace Engineering and aid their futures in Aerospace engineering by bridging the gap between students and the industry."
"1523568745-128","https://knightconnect.campuslabs.com/engage/organizations","https://images.collegiatelink.net/clink/images/b39a6374-841b-4fee-8ebc-b54fa1a78179331d93e7-311b-4c50-afbb-545602464a68.jpg?preset=small-sq","ATHENA Women Empowered","WE are a group of diverse women who come together to support each other through the self-discovery process, bridging the gap between college and career, and connecting to influential women leaders in our community."
"1523568745-559","https://knightconnect.campuslabs.com/engage/organizations","https://images.collegiatelink.net/clink/images/f2e317c0-5273-4599-bc12-17ad1ffc495f00beaea4-31f5-4aef-bc58-c34c15c8ecb8.jpg?preset=small-sq","SCUBA Club @ UCF","A group of active Scuba divers who wish to mentor other students, to become better divers, and to conserve the underwater world."
"1523568745-507","https://knightconnect.campuslabs.com/engage/organizations","https://images.collegiatelink.net/clink/images/eb4ebb69-92db-4a5f-965c-49353962315f0b20c513-67ef-4aa6-94d2-1b910d7146d5.jpg?preset=small-sq","Pre-Dental Student Association","This club is dedicated to educating and helping students interested in the field of dentistry with information about the field, the application process, and requirements for dental school."
"1523568745-519","https://knightconnect.campuslabs.com/engage/organizations","https://images.collegiatelink.net/clink/images/92aa174c-ec18-450e-a255-c2075f8cb58754eba3c4-b082-470f-b9d3-418328b1c157.png?preset=small-sq","Project: Student Poetry Initiating Thought",".The mission of Project: S.P.I.T. is to create a spoken word/poetry community and awareness on the UCF campus that promotes and develops creative writing, allowing students to be in a safe environment that enables them to express and grow in the art form"
"1523568745-283","https://knightconnect.campuslabs.com/engage/organizations","https://images.collegiatelink.net/clink/images/4da3fb3e-a1c5-42e1-aac2-edb61081cb777c0ec323-6654-4810-96cf-beefb6e5372c.png?preset=small-sq","Graduate Health Network","This mission of the Graduate Health Network is to bring students in healthcare together who are interested in opportunities to develop their leadership skills while providing scholarship and networking opportunities in healthcare"
"1523568745-269","https://knightconnect.campuslabs.com/engage/organizations","https://images.collegiatelink.net/clink/images/07110405-9756-4f92-8fc0-8598a5e0cc3f590c0f2a-7def-4cfe-969e-7602f7851098.jpg?preset=small-sq","Future Theme Park Leaders Association","The Future Theme Park Leaders Association (FTPLA) is a student-run organization at UCF's Rosen College of Hospitality Management focused on the study of the theme park and attraction industry for personal development and success for all of our members."
"1523568745-566","https://knightconnect.campuslabs.com/engage/organizations","https://images.collegiatelink.net/clink/images/e968e48b-9e92-4168-a13a-ee0ae2b3913d8f40dbe3-976a-43b1-9edc-0f25c8ceb6f6.jpg?preset=small-sq","Sigma Alpha Epsilon","The mission of Sigma Alpha Epsilon is to promote the highest standards of friendship, scholarship and service for our members based upon the ideals set forth by our Founders and as specifically enunciated in “The True Gentleman.”"
"1523568745-416","https://knightconnect.campuslabs.com/engage/organizations","https://images.collegiatelink.net/clink/images/9cb69d5e-e51f-41e4-95a6-f333c8c9597125b511c1-e8a5-42b3-a91d-108439359b04.jpg?preset=small-sq","Moot Court Organization","The mission of the Moot Court Organization is to create a forum in which students with an interest in the law can discuss issues of constitutional law and develop advocacy skills through participation in the American Moot Court Association competition."
"1523568745-158","https://knightconnect.campuslabs.com/engage/organizations","","B","The mission of the Business Leadership Council is to provide the leaders of various Business Registered Student Organizations a place where they can meet in order to communicate information about their organizations"
"1523568745-101","https://knightconnect.campuslabs.com/engage/organizations","https://images.collegiatelink.net/clink/images/fb694b1c-0a4a-4dd4-ba86-986ce2fee28538b878f2-f975-4216-a975-548b544c7a1d.jpg?preset=small-sq","American Society of Civil Engineers","An organization that aims to promote professionalism, leadership and hands-on learning for civil, environmental, or construction engineering students."
"1523568745-263","https://knightconnect.campuslabs.com/engage/organizations","https://images.collegiatelink.net/clink/images/ad0e734c-0e44-4755-b941-f9d5230c991d323603e5-9480-442e-ae02-8ebbd1f984f1.png?preset=small-sq","For Florida's Future","For Florida's Future seeks to mobilize and empower students and organizations to drive change and advance our progressive values in shared prosperity, strong public schools, climate change, and racial justice."
"1523568745-520","https://knightconnect.campuslabs.com/engage/organizations","","P","Psi Chi is an international honor society whose purpose shall be to encourage, stimulate, and maintain excellence in scholarship of the individual members in all fields, particularly in psychology, and to advance the science of psychology."
"1523568745-549","https://knightconnect.campuslabs.com/engage/organizations","","R","The mission of Rotaract at Rosen College of Hospitality Management is to carry out activities focusing on community and international service projects, leadership development and professional development in affiliation with local Rotary clubs and Rotary"
"1523568745-148","https://knightconnect.campuslabs.com/engage/organizations","https://images.collegiatelink.net/clink/images/1f0e985b-2afc-411d-9b20-3d33c2c3906efcf80f5e-5b39-49ab-ba11-603067937a16.jpg?preset=small-sq","Black and Gold Studios","Black & Gold Studios is the Office of Student Involvement's on-campus recording studio, located in All Knight Study 2 at Ferrell Commons."
"1523568745-149","https://knightconnect.campuslabs.com/engage/organizations","https://images.collegiatelink.net/clink/images/273156fb-d582-4316-9ba8-9074d42e41ab723b5f00-7164-41d5-8915-e4a55202f66f.gif?preset=small-sq","Black Female Development Circle","To educate, explore, enhance, and celebrate womanhood on the campus and in the community by building upon the intellectual capacity of women through self-awareness, self-respect, and self-actualization."
"1523568745-359","https://knightconnect.campuslabs.com/engage/organizations","https://images.collegiatelink.net/clink/images/61efcd0b-b7b5-4be3-a7e7-208aa054917d7514687e-d758-4de7-a4b9-2ae92588e3b1.jpg?preset=small-sq","Knights Blade","To provide for a safe, realistic, and practical method of experiencing historically accurate Medieval & Renaissance fencing skills, and to promote interest in and the advancement of historically accurate Medieval and Renaissance fencing."
"1523568745-336","https://knightconnect.campuslabs.com/engage/organizations","https://images.collegiatelink.net/clink/images/8c2e3852-526c-4019-a8fe-2d7b36376e92473a975f-2eed-4431-9404-98bf4251b677.jpg?preset=small-sq","John T. Washington Honor Society","To uphold the legacy of the late Dr. John T. Washington, we seek to question, evaluate, and raise the standard of education for the African-American student. We uphold the principles of scholarship, leadership and service."
"1523568745-176","https://knightconnect.campuslabs.com/engage/organizations","https://images.collegiatelink.net/clink/images/050bea42-f460-49b2-aa75-80c43607b44abf5bdcd6-eb22-44c1-9679-97c6ad61738b.jpg?preset=small-sq","Chi Omega Fraternity","Chi Omega is an intergenerational women’s organization committed to our purposes:

Friendship
Personal Integrity
Service to Others
Academic Excellence and Intellectual Pursuits
Community and Campus Involvement
Personal and Career Development"
"1523568745-327","https://knightconnect.campuslabs.com/engage/organizations","https://images.collegiatelink.net/clink/images/0a5c4ea0-12f6-42ab-9858-4a358c253aa4967a3f32-c5b4-4787-b878-79f0f8f7cc56.jpg?preset=small-sq","International Relations Club","Do you love international politics and keeping up with current events? Does your five-year plan involve going to a foreign country and changing the world? Are you looking for ways to advance your career, travel, network, and make friends? Then join IRC!"
